{
 "type": "kill_command",
 "schema_version": "2.0",
 "command_id": "6f1c2b9e-3d4a-4e5f-8a7b-1c2d3e4f5a6b",
 "command_seq": 11,
 "request": "deactivate",
 "feature": {
  "id": "FEAT-00022",
  "version": "1.0.0",
  "f_class": "F3",
  "deact_class": "DC2"
 },
 "reason": {
  "category": "SAFETY",
  "code": "DIST_EST_BIAS",
  "incident_id": "INC-2026-0412"
 },
 "scope": {
  "vehicle_ids": [
   "VHC-000123",
   "VHC-000124"
  ],
  "cohort_id": "UPG-VC-SAMPLE-00025",
  "max_vehicles": 2
 },
 "target": {
  "market": "EU",
  "ecu_id": "ECU-ADAS-01",
  "sw_id": "SW-CARE-SCC-ADP",
  "sw_version": "2.3.0",
  "rxswin": "R79-SCC-ADP-0230"
 },
 "validity": {
  "not_before": "2026-10-13T00:00:00Z",
  "expires_at": "2026-10-13T12:00:00Z"
 },
 "approvals": [
  {
   "approver_id": "u-1001",
   "role": "FSM",
   "signed_at": "2026-10-12T23:50:00Z",
   "approval_sig": "-decp92lOz6w4vDctXnfmf4mxyEMILWO5xmj7avn9aPbio_Nh5ZWkHYX9BqB3QnhWYXCHz4sluIoX_R74d3zog"
  },
  {
   "approver_id": "u-2002",
   "role": "OPS_LEAD",
   "signed_at": "2026-10-12T23:52:00Z",
   "approval_sig": "TnZXOjkrKhBqXfsZ86hv0JavQVNnPVxSoUSs5UsGvMP3JPXclXyGN_BYVXvShqPFE0qGPeHrWSSIjif4fbSECA"
  }
 ],
 "regulatory": {
  "type_approval_impact": "NONE",
  "r156_assessment_id": "SUMS-IA-2026-0981",
  "containment_justification": "Interim containment pending root cause; recall decision INC-2026-0412"
 },
 "user_notice": {
  "required": true,
  "text_ref": "HMI-TXT-FEAT00022-DEACT"
 },
 "evidence": {
  "evidence_manifest_id": "EVM-FEAT-00022-1.0.0-0412",
  "bom_baseline_id": "BOM-2026.10.1",
  "sbom_ref": "urn:cdx:3e671687-395b-41f5-a30f-a58921a69b79/1"
 },
 "issued_by": "ops-console",
 "issued_at": "2026-10-12T23:55:00Z",
 "signature": {
  "alg": "ES256",
  "kid": "ffp-cp-2026-01",
  "value": "LUpm-h_5gtF6Ow28diDHK2MhGfFgDkTvjlBfR_yefnz2TIyUFlmLx6DtDbkd4_tHGz0TFNg3mXt4grIsHAWgMQ"
 }
}
